<?xml version="1.0" encoding="UTF-8"?>

<circuito xsi:schemaLocation= "http://www.uniovi.es circuito.xsd"
          xmlns="http://www.uniovi.es"
          xmlns:xsi="http://www.w3.org/2001/XMLSchema-instance">
    <nombre>Autódromo Internacional do Algarve</nombre>

    <longitudCircuito unidad="m">3.684</longitudCircuito>
    <anchura unidad="m">14</anchura>

    <fechaCarrera>2025-11-16</fechaCarrera>
    <horaInicio>14:00:00</horaInicio>
    <numeroVueltas>25</numeroVueltas>
    <localidad>Algarve</localidad>
    <pais>Portugal</pais>
    <patrocinador>Qatar Airways</patrocinador>

    <referencias>
        <referencia>https://autodromodoalgarve.com/</referencia>
        <referencia>https://www.motogp.com/en/calendar/2025/event/portugal/632adf30-be24-4b42-8276-2bdb174f22d1?tab=overview</referencia>
        <referencia>https://es.wikipedia.org/wiki/Aut%C3%B3dromo_Internacional_do_Algarve</referencia>
    </referencias>

    <fotos>
        <foto>../../sew2526/multimedia/img/circuito_sectores.webp"</foto>
    </fotos>

    <videos>
        <video>../multimedia/video/circuito.mp4</video>
    </videos>

    <puntoOrigen>
        <longitud>-8.6309250</longitud>
        <latitud>37.2323871</latitud>
        <altitud>103.41</altitud>
    </puntoOrigen>
    <tramos>
        <!-- 1 -->
        <tramo unidad="m">
            <distancia>352.84</distancia>
            <longitud>-8.6320307</longitud>
            <latitud>37.2354402</latitud>
            <altitud>100.3553643</altitud>
            <sector>1</sector>
            <nombrePunto>1.1</nombrePunto>
        </tramo>
        <tramo unidad="m">
            <distancia>20.21</distancia>
            <longitud>-8.6320494</longitud>
            <latitud>37.2356182</latitud>
            <altitud>101.0045253</altitud>
            <sector>1</sector>
            <nombrePunto>1.2</nombrePunto>
        </tramo>
        <tramo unidad="m">
            <distancia>15.59</distancia>
            <longitud>-8.6319412</longitud>
            <latitud>37.2357294</latitud>
            <altitud>101.5746302</altitud>
            <sector>1</sector>
            <nombrePunto>1.3</nombrePunto>
        </tramo>
        <!-- 2 -->
        <tramo unidad="m">
            <distancia>131.84</distancia>
            <longitud>-8.6307393</longitud>
            <latitud>37.2364294</latitud>
            <altitud>103.6100883</altitud>
            <sector>1</sector>
            <nombrePunto>2.1</nombrePunto>
        </tramo>
        <tramo unidad="m">
            <distancia>13.51</distancia>
            <longitud>-8.6305944</longitud>
            <latitud>37.2364803</latitud>
            <altitud>103.6930394</altitud>
            <sector>1</sector>
            <nombrePunto>2.2</nombrePunto>
        </tramo>
        <tramo unidad="m">
            <distancia>19.43</distancia>
            <longitud>-8.6303780</longitud>
            <latitud>37.2364848</latitud>
            <altitud>103.9399954</altitud>
            <sector>1</sector>
            <nombrePunto>2.3</nombrePunto>
        </tramo>
        <!-- 3 -->
        <tramo unidad="m">
            <distancia>124.64</distancia>
            <longitud>-8.6290171</longitud>
            <latitud>37.2362111</latitud>
            <altitud>105.4645908</altitud>
            <sector>1</sector>
            <nombrePunto>3.1</nombrePunto>
        </tramo>
        <tramo unidad="m">
            <distancia>19.77</distancia>
            <longitud>-8.6288551</longitud>
            <latitud>37.2360864</latitud>
            <altitud>105.6801841</altitud>
            <sector>1</sector>
            <nombrePunto>3.2</nombrePunto>
        </tramo>
        <tramo unidad="m">
            <distancia>24</distancia>
            <longitud>-8.6289713</longitud>
            <latitud>37.2358895</latitud>
            <altitud>105.1555418</altitud>
            <sector>1</sector>
            <nombrePunto>3.3</nombrePunto>
        </tramo>
        <!-- 4 -->
        <tramo unidad="m">
            <distancia>88.23</distancia>
            <longitud>-8.6298074</longitud>
            <latitud>37.2354853</latitud>
            <altitud>115.3550100</altitud>
            <sector>1</sector>
            <nombrePunto>4.1</nombrePunto>
        </tramo>
        <tramo unidad="m">
            <distancia>34.61</distancia>
            <longitud>-8.6300566</longitud>
            <latitud>37.2352268</latitud>
            <altitud>109.5173723</altitud>
            <sector>1</sector>
            <nombrePunto>4.2</nombrePunto>
        </tramo>
        <tramo unidad="m">
            <distancia>34.67</distancia>
            <longitud>-8.6300786</longitud>
            <latitud>37.2349193</latitud>
            <altitud>111.4454957</altitud>
            <sector>1</sector>
            <nombrePunto>4.3</nombrePunto>
        </tramo>

        <!-- 5 -->
        <tramo unidad="m">
            <distancia>520.02</distancia>
            <longitud>-8.6284516</longitud>
            <latitud>37.2304183</latitud>
            <altitud>103.6930394</altitud>
            <sector>2</sector>
            <nombrePunto>5.1</nombrePunto>
        </tramo>
        <tramo unidad="m">
            <distancia>22.01</distancia>
            <longitud>-8.6282571</longitud>
            <latitud>37.2302930</latitud>
            <altitud>104.5595649</altitud>
            <sector>2</sector>
            <nombrePunto>5.2</nombrePunto>
        </tramo>
        <tramo unidad="m">
            <distancia>22.43</distancia>
            <longitud>-8.6280559</longitud>
            <latitud>37.2304237</latitud>
            <altitud>104.7902144</altitud>
            <sector>2</sector>
            <nombrePunto>5.3</nombrePunto>
        </tramo>
        <!-- 6 -->
        <tramo unidad="m">
            <distancia>174.8</distancia>
            <longitud>-8.6278504</longitud>
            <latitud>37.2319909</latitud>
            <altitud>114.8394078</altitud>
            <sector>2</sector>
            <nombrePunto>6.1</nombrePunto>
        </tramo>
        <tramo unidad="m">
            <distancia>44.6</distancia>
            <longitud>-8.6278587</longitud>
            <latitud>37.2323899</latitud>
            <altitud>117.2750759</altitud>
            <sector>2</sector>
            <nombrePunto>6.2</nombrePunto>
        </tramo>
        <tramo unidad="m">
            <distancia>46.06</distancia>
            <longitud>-8.6280396</longitud>
            <latitud>37.2327770</latitud>
            <altitud>118.8010785</altitud>
            <sector>2</sector>
            <nombrePunto>6.3</nombrePunto>
        </tramo>
        <!-- 7 -->
        <tramo unidad="m">
            <distancia>149.79</distancia>
            <longitud>-8.6288217</longitud>
            <latitud>37.2339718</latitud>
            <altitud>117.9939000</altitud>
            <sector>2</sector>
            <nombrePunto>7.1</nombrePunto>
        </tramo>
        <tramo unidad="m">
            <distancia>29.51</distancia>
            <longitud>-8.6288872</longitud>
            <latitud>37.2342320</latitud>
            <altitud>117.8235894</altitud>
            <sector>2</sector>
            <nombrePunto>7.2</nombrePunto>
        </tramo>
        <tramo unidad="m">
            <distancia>30.75</distancia>
            <longitud>-8.6287528</longitud>
            <latitud>37.2344884</latitud>
            <altitud>103.6930394</altitud>
            <sector>1</sector>
            <nombrePunto>7.3</nombrePunto>
        </tramo>
        <!-- 8 -->
        <tramo unidad="m">
            <distancia>92.39</distancia>
            <longitud>-8.6280734</longitud>
            <latitud>37.2351166</latitud>
            <altitud>117.5183686</altitud>
            <sector>2</sector>
            <nombrePunto>8.1</nombrePunto>
        </tramo>
        <tramo unidad="m">
            <distancia>32</distancia>
            <longitud>-8.6277315</longitud>
            <latitud>37.2351749</latitud>
            <altitud>103.6930394</altitud>
            <sector>2</sector>
            <nombrePunto>8.2</nombrePunto>
        </tramo>
        <tramo unidad="m">
            <distancia>32.09</distancia>
            <longitud>-8.6275146</longitud>
            <latitud>37.2349472</latitud>
            <altitud>121.8144785</altitud>
            <sector>2</sector>
            <nombrePunto>8.3</nombrePunto>
        </tramo>
        <!-- 9 -->
        <tramo unidad="m">
            <distancia>287.48</distancia>
            <longitud>-8.6270382</longitud>
            <latitud>37.2323838</latitud>
            <altitud>113.8095854</altitud>
            <sector>2</sector>
            <nombrePunto>9.1</nombrePunto>
        </tramo>
        <tramo unidad="m">
            <distancia>48</distancia>
            <longitud>-8.6268462</longitud>
            <latitud>37.2319807</latitud>
            <altitud>114.7246975</altitud>
            <sector>2</sector>
            <nombrePunto>9.2</nombrePunto>
        </tramo>
        <tramo unidad="m">
            <distancia>47.12</distancia>
            <longitud>-8.6264320</longitud>
            <latitud>37.2317121</latitud>
            <altitud>116.9729443</altitud>
            <sector>2</sector>
            <nombrePunto>9.3</nombrePunto>
        </tramo>
        <!-- 10 -->
        <tramo unidad="m">
            <distancia>143.05</distancia>
            <longitud>-8.6250020</longitud>
            <latitud>37.2311196</latitud>
            <altitud>126.8271001</altitud>
            <sector>2</sector>
            <nombrePunto>10.1</nombrePunto>
        </tramo>
        <tramo unidad="m">
            <distancia>32.14</distancia>
            <longitud>-8.6247046</longitud>
            <latitud>37.2309480</latitud>
            <altitud>126.9202382</altitud>
            <sector>2</sector>
            <nombrePunto>10.2</nombrePunto>
        </tramo>
        <tramo unidad="m">
            <distancia>27.66</distancia>
            <longitud>-8.6245280</longitud>
            <latitud>37.2307439</latitud>